{
  "status": "OK",
  "paper_slug": "herskind-riede-2024",
  "escalate_reason": null,
  "stated_availability": "Three distinct statements, descriptive only (not mapped to L1-L6). (1) Data availability statement (p. 8): \"Supplementary Information to this article can be found online at https://zenodo.org/records/10801706.\" (2) Methods section 2.2 (p. 3): \"Dedicated R code and complete data tables are reported in Supplementary Information S2 and S3. All analyses were performed in the open-source R programming environment (v.4.2.2; R Core Team, 2021), using the Quanteda package (Benoit et al., 2018). All code and data are available here: https://zenodo.org/records/10623550.\" (3) Appendix A: \"Supplementary data to this article can be found online at https://doi.org/10.1016/j.jas.2024.105969.\" Section 2 also cites \"a total of 483 objects (Supplementary Information S1)\". Article licence stated on p. 1: \"This is an open access article under the CC BY license (http://creativecommons.org/licenses/by/4.0/).\" Note: two different Zenodo record identifiers (10623550 and 10801706) are cited for the accompanying materials; neither is printed as a DOI string. Funding: \"No funding sources were involved in this article.\" No ORCIDs printed; CRediT statement present but assigns no Software role.",
  "data_fair": {
    "available": true,
    "total": 12,
    "sub_principles": {
      "F1": {
        "present": 1,
        "evidence": "Deposit identified by Zenodo record accessions: \"All code and data are available here: https://zenodo.org/records/10623550\" (Methods 2.2, p. 3) and \"Supplementary Information to this article can be found online at https://zenodo.org/records/10801706\" (Data availability statement, p. 8). Zenodo record IDs are globally unique repository accessions in a DataCite-registered registry, satisfying the instrument's F1 enumeration (\"DOI, IGSN, SWHID, accession\"). Caveat recorded: the paper prints record URLs, not explicit DOI strings (e.g. no 10.5281/zenodo.* form), and cites two different record numbers for the same materials."
      },
      "F2": {
        "present": 1,
        "evidence": "Materials deposited in Zenodo, which generates structured DataCite metadata (creators, title, description, resource type, publication year) for every record. The paper further evidences descriptive richness of the deposited data itself: \"These data consist of numerous categorical variables corresponding to the characteristics of each ornamented object and associated metadata such as location, quality of contextual information, and original source\" (p. 2)."
      },
      "F3": {
        "present": 1,
        "evidence": "Zenodo/DataCite records carry the record identifier within their own metadata payload as a matter of platform design, so the metadata describing the deposit explicitly includes the identifier by which the deposit is retrieved (https://zenodo.org/records/10623550, https://zenodo.org/records/10801706)."
      },
      "F4": {
        "present": 1,
        "evidence": "Deposited in Zenodo, named explicitly in the instrument as a qualifying searchable registry (\"F4: Resource indexed in searchable registry (Zenodo, CRAN, DataCite)\"). Paper cites two Zenodo records (10623550, 10801706)."
      },
      "A1": {
        "present": 1,
        "evidence": "Retrievable via HTTPS from Zenodo: \"All code and data are available here: https://zenodo.org/records/10623550\" (p. 3). Assessed against the full research dataset per the completeness rule: coverage_category is \"substantial\" (75%; 3 of 4 enumerated datasets at Tier 0), and record-weighted coverage is approximately 100% because all 483 analysed objects sit in the deposited digitised dataset (\"With a total of 483 objects (Supplementary Information S1)\", p. 2). Since coverage is neither \"minimal\" nor \"partial\", A1 is not forced to 0; a majority of the research data is retrievable by standard protocol."
      },
      "A1_1": {
        "present": 1,
        "evidence": "Access is by HTTPS to a public Zenodo record with no login, subscription, or proprietary client required. The analysis environment is likewise open: \"All analyses were performed in the open-source R programming environment (v.4.2.2; R Core Team, 2021), using the Quanteda package (Benoit et al., 2018)\" (p. 3)."
      },
      "A1_2": {
        "present": 1,
        "evidence": "No access restriction is required for this material (motif codings transcribed from a published catalogue of museum-held Mesolithic portable art; no human subjects, Indigenous, or otherwise sensitive data), and none is imposed. The retrieval protocol (HTTPS via Zenodo) supports authentication/authorisation procedures where they are necessary, so the sub-principle is met; there is no unjustified closure."
      },
      "A2": {
        "present": 1,
        "evidence": "Deposited in Zenodo, a repository with an institutional commitment to metadata persistence (DataCite-registered metadata and tombstone records survive withdrawal of the files). The instrument credits exactly this case (\"Repository committed to metadata persistence (Zenodo, DANS, institutional commitment)\")."
      },
      "I1": {
        "present": 1,
        "evidence": "Data are structured tabular/categorical by construction and deposited alongside executable R code: \"Dedicated R code and complete data tables are reported in Supplementary Information S2 and S3\" (p. 3); \"Plonka's (2003, pp. 315-325) own motif classification scheme ... was transcribed as binary data in the form of presence/absence coding of motif types (named A1, A2, etc.) on each individual artefact\" (p. 2). For the deposited R/quanteda pipeline to run, the data must be in a machine-parseable representation. Inference limit noted: the paper states no file formats, and the deposit was not inspected (paper is the sole source)."
      },
      "I2": {
        "present": 0,
        "evidence": "No FAIR vocabulary is used. The motif taxonomy is Plonka's own idiosyncratic scheme from a print monograph (\"named A1, A2, etc.\", p. 2), chronological units are conventional culture-historical labels (\"Maglemose (~11,000-8400 BP), Kongemose (~8400-7400 BP), and Erteboelle (~7400-5950 BP)\", p. 2) with no PeriodO URIs, and artefact classes (axe, shaft, pendant, etc., Fig. 2) are ad hoc. No Getty AAT, CIDOC-CRM, PeriodO, Pleiades, or ARIADNEplus vocabulary is cited. The authors acknowledge the taxonomic looseness: \"We have not, in our analysis, tested for inter-coder consistency (such as in Dutkiewicz et al., 2020), nor have we explored the effects of variable classifications of related motifs\" (p. 7)."
      },
      "I3": {
        "present": 0,
        "evidence": "No qualified, typed PID references from the data artefact are evidenced. The upstream source is cited only as a bibliographic reference with no PID: \"Plonka, T., 2003. The portable art of mesolithic europe, acta universitatis wratislaviensis. Wydawn. Uniw. Wroclawskiego, Wroclaw\" (reference list, p. 9) - no DOI. No \"isDerivedFrom\"/\"isSupplementTo\" relationship assertions are stated in the paper, and the two cited Zenodo records are not linked to each other or to the article DOI by any stated typed relation."
      },
      "R1": {
        "present": 1,
        "evidence": "Plurality of relevant attributes explicitly documented: \"These data consist of numerous categorical variables corresponding to the characteristics of each ornamented object and associated metadata such as location, quality of contextual information, and original source\" (p. 2); \"We do include pertinent metadata such as artefact classes, chronology, and spatial distribution that can be drawn upon in substantiating claims for semiotic significance\" (p. 7). Table 3 exemplifies the per-object attribute set (site, region, artefact type, motifs, source figure in Plonka 2003)."
      },
      "R1_1": {
        "present": 1,
        "evidence": "Explicit, standard, URL-linked licence covering the article and its supplementary information, where S1-S3 are reported: \"This is an open access article under the CC BY license (http://creativecommons.org/licenses/by/4.0/)\" (p. 1), with Appendix A directing supplementary data to the article DOI (\"Supplementary data to this article can be found online at https://doi.org/10.1016/j.jas.2024.105969\"). Caveat recorded: the paper states no separate licence for the Zenodo deposits themselves."
      },
      "R1_2": {
        "present": 1,
        "evidence": "Detailed provenance chain documented in Methods: source (\"the comprehensive catalogue of Mesolithic ornamentation compiled by Plonka (2003)\"), extraction (\"From this analogue compilation, the South Scandinavian data were manually extracted and digitised\"), coding (\"transcribed as binary data in the form of presence/absence coding\"), transformation (\"transformed from presence/absence coding into a sentence-imitating structure\"), parameters (\"the k value for all generated skipgrams is thus set to 13\", plus the printed expected-frequency and PMI formulae), and software versions (R v.4.2.2, quanteda). \"Original source\" is additionally retained as a per-object variable."
      },
      "R1_3": {
        "present": 0,
        "evidence": "No domain-relevant community standard is met. Deposit is to a general-purpose repository (Zenodo), not an archaeological domain repository (tDAR, Open Context, ARIADNEplus), and no domain metadata schema (Dublin Core profile, CIDOC-CRM, ARIADNE) is stated. The paper itself contrasts its approach with the emerging open standard it did not adopt: \"Open-source databases of prehistoric art are emerging (e.g., Dutkiewicz et al., 2020)\" (p. 2, referring to SignBase), and the analysis rests instead on \"this analogue compilation\"."
      }
    }
  },
  "code_fair": {
    "available": true,
    "total": 12,
    "sub_principles": {
      "F1": {
        "present": 1,